{
  "schema_version": "1.0.0",
  "hash": "sha256:0000000000000000000000000000000000000000000000000000000000000000",
  "timestamp": "2025-10-24T22:00:00Z",
  "task_id": "example-task",
  "task_type": "ios-ui",
  "agent": "swiftui-developer",
  "metadata": {
    "session_id": "session-20251024-example",
    "user_requirement": "Example user requirement from user-request.md",
    "completion_criteria_version": "1.0.0"
  },
  "evidence": {
    "screenshots": {
      "ios_simulator": "data:image/png;base64,iVBORw0KGgoAAAANSUhEUgAAAAEAAAABCAYAAAAfFcSJAAAADUlEQVR42mNk+M9QDwADhgGAWjR9awAAAABJRU5ErkJggg=="
    },
    "test_outputs": {
      "xcode_build": "Build succeeded. Exit code: 0\n...",
      "xctest": "Test Suite 'All tests' passed at 2025-10-24 22:00:00.000.\n..."
    },
    "build_logs": {
      "build_command": "xcodebuild build -scheme ExampleApp",
      "exit_code": 0,
      "stdout": "Build output...",
      "stderr": ""
    },
    "verification_report": "# Verification Report\n\nAll deliverables met.\n\nVerdict: PASSED",
    "design_review": "# Design Review Report\n\nAll design checks passed."
  },
  "deliverables_met": {
    "source_files": true,
    "ios_screenshot": true,
    "build_success": true,
    "ui_tests": true,
    "accessibility_audit": true,
    "visual_review": true
  },
  "verification_verdict": "PASSED",
  "quality_score": null,
  "signature": {
    "signer": "verification-agent",
    "signed_at": "2025-10-24T22:00:05Z",
    "algorithm": "sha256"
  }
}
